{
    "title": "Le cycle ingénieur ROB",
    "url": "https://www.polytech.sorbonne-universite.fr/formations/robotique",
    "content": "Le cycle ingénieur Robotique (ROB) est un cycle ingénieur (Bac+3 à Bac+5) de Polytech-Sorbonne. Cette spécialité forme des ingénieurs pluridisciplinaires dans les domaines de la mécanique, de l’informatique, de l’automatique et du traitement des signaux et des images. Cette formation est tournée vers l’innovation et la haute technologie. Les systèmes robotiques sont le fil rouge de la formation. Ils permettent de cristalliser les connaissances acquises dans ces matières fondamentales autour d’un même objet et ainsi développer la compétence centrale de l’ingénieur pluridisciplinaire : l’intégration. \n Le cycle ingénieur ROB une des seules formations d'ingénieurs en France mettant la robotique au coeur de ses enseignements tout au long des trois années du cycle d'ingénieur. Elle forme des ingénieurs pluridisciplinaires capables d’appréhender la création d’un système robotique dans son ensemble. \n L'équipe pédagogique de la spécialité robotique est principalement constituée d'enseignants-chercheurs de l'ISIR (Institut des Systèmes Intelligents et de Robotique), l'un des plus importants laboratoires de recherche universitaire français en robotique. \n La formation robotique est tournée vers l’innovation et la haute technologie et s’appuie sur des bases de mécanique, d’électronique et d’informatique. Quasiment unique en France, la spécialité propose une approche intégrée des sciences de l’ingénieur adaptée aux besoins des entreprises développant les systèmes intelligents de demain. Les élèves-ingénieurs sont formés à la conception et au développement de systèmes complexes. \n Orientés R&D, ces ingénieurs intégrateurs peuvent mener des équipes de spécialistes ou des projets pluridisciplinaires. La formation s’articule autour de nombreux enseignements expérimentaux et la réalisation de projets. Les compétences acquises par les diplômés leur permettent d’intégrer tous les secteurs traditionnels de l’ingénierie bien au-delà de l’industrie robotique. \n Pour en savoir davantage ou pour consulter le programme détaillé de la formation, rendez-vous sur cette page web : https://www.polytech.sorbonne-universite.fr/formations/robotique",
    "category1": "polytech.sorbonne-universite.fr",
    "category2": "formations",
    "category3": "cycles ingénieur",
    "category4": "rob",
    "filierespecifique": "ROB",
    "datespecifique": "NA"
}